{
  "schemaVersion": 1,
  "profile": "standalone-raster",
  "id": "ST-DRINK-BEER-TIER-1",
  "sourceRevision": 4,
  "screenUnit": "SCR-SVC-DRINK",
  "semanticOwner": "Artist 3 / D1-DRINK-SERVICE-CLEANUP-CUSTOMER-SETTLEMENT",
  "assetMeaning": "원통형 황동 단일 탭 맥주 머신과 중앙 소형 타공 드립 트레이의 투명 고정 layer",
  "sourceEvidence": [
    {
      "file": "../source/st-drink-beer-tier-1-chroma-r4.png",
      "sha256": "320c753d4594d9326c9f3fdbdfb79fcf9ac26375609ed12e340604ae0f2081fc"
    },
    {
      "file": "../../../../../concept-masters/2026-07-26/06_drink-station-master.png",
      "sha256": "667e8f704c74f6515e1a401fc4e2e0981545226fb42ce3f6916e9624fa183ee2"
    }
  ],
  "output": {
    "file": "../assets/st-drink-beer-tier-1-r4.png",
    "sha256": "a0bd01f55f893520d48b8e38bccdb18c90868c228f6a7336eab43f162d0f6ed1",
    "bytes": 243511,
    "width": 1920,
    "height": 1080,
    "alpha": "straight",
    "greenSpillPixels": 0
  },
  "reviewBoard": {
    "file": "../review/review-st-drink-beer-tier-1-isolated-fhd-r4.png",
    "sha256": "99866795581de7c227905060a428120e9f66b09e423ecfcc60628cb412dda70c",
    "width": 1920,
    "height": 1080,
    "subjectAssetOnly": true
  },
  "lossPolicy": "lossless-required",
  "excludes": ["people or body parts", "raster UI or text", "glass beer foam liquid or VFX", "food or serving props"],
  "approval": {
    "status": "approved-by-user",
    "date": "2026-08-03",
    "basis": "사용자가 컨셉 정합 R4 source와 FHD/720 소비 화면을 최종 승인했다."
  },
  "runtimeRegistrationAllowed": false
}
