{
  "schemaVersion": 1,
  "profile": "standalone-raster",
  "id": "UI-CUSTOMER-CONSIDERING",
  "sourceRevision": 1,
  "screenUnit": "SCR-SVC-CUSTOMERS",
  "semanticOwner": "customer-head-state",
  "assetMeaning": "착석한 손님이 메뉴를 고르는 중임을 나타내는 완결형 말줄임표 말풍선",
  "sourceEvidence": [
    {
      "file": "../../../../../../artist-009/customer-screen/r3/customer-service-fhd-r3.png",
      "sha256": "cd7dff413b532dbbd4e96d28b2ec4c6746c995057f1830fe825787bb1c04263f",
      "bytes": 2726762,
      "role": "approved-style-reference"
    },
    {
      "file": "../../../../r1/assets/customer-state-considering-visible.png",
      "sha256": "fec74f1f1e74c253ee7e08399b99fb1c324abbe4e2ee27db23f9b904b32a0429",
      "bytes": 7630,
      "role": "legacy-silhouette-cue"
    },
    {
      "file": "../source/considering-chroma-source.png",
      "sha256": "74e6afe4f6d2c3e14cad6a893b6008ea7bbbe3999a6a162a9063a76e5033b1bc",
      "bytes": 1125616,
      "role": "generation-source"
    }
  ],
  "output": {
    "file": "../assets/customer-state-considering-r1.png",
    "sha256": "c2c6400be384a8d5303bb51201ee9c4d65e01196aa42a23180659bce45057bca",
    "bytes": 13234,
    "width": 192,
    "height": 144,
    "alpha": "straight",
    "greenSpillPixels": 0
  },
  "reviewBoard": {
    "file": "../review-considering-fhd-r1.png",
    "sha256": "3480fbde96987ec45d7bc82be8dcd286141ceafcdc8d1ee091ad7f7756f109e9",
    "bytes": 31441,
    "width": 1920,
    "height": 1080,
    "subjectAssetOnly": true
  },
  "lossPolicy": "lossless-required",
  "excludes": [
    "customer or hand",
    "food or drink",
    "timer, order, badge, text, number, gauge, or frame",
    "background scene or cast shadow"
  ],
  "approval": {
    "status": "approved-by-user",
    "date": "2026-07-26",
    "basis": "사용자가 완결형 말풍선 실루엣, 3점 가독성, 색 관계를 승인했다."
  },
  "runtimeRegistrationAllowed": false
}
